{
  "$schema": "https://json-schema.org/draft/2020-12/schema",
  "$id": "https://sitkastack.com/schemas/vendor-risk-triage/input-contract/1.0.0.json",
  "title": "Vendor Risk Triage Input Contract",
  "description": "Schema a vendor documentation submission must conform to before the triage agent will process it. Submissions that validate are eligible for triage; submissions that fail are rejected at intake or routed to normalization.",
  "$ref": "#/$defs/base",
  "unevaluatedProperties": false,
  "$defs": {
    "base": {
      "type": "object",
      "required": [
        "vendor_id",
        "vendor_name",
        "jurisdiction",
        "primary_contact",
        "vendor_classification",
        "ai_usage_level",
        "documentation_artifacts",
        "submission_timestamp",
        "schema_version"
      ],
      "properties": {
        "vendor_id": {
          "type": "string",
          "minLength": 1,
          "maxLength": 128,
          "description": "Stable unique identifier for the vendor, assigned by the deploying organization. Attributes the triage record and links re-reviews of the same vendor over time."
        },
        "vendor_name": {
          "type": "string",
          "minLength": 1,
          "maxLength": 256,
          "description": "Legal or commonly used name of the vendor, as it should appear in the triage record and any board or examiner reporting."
        },
        "jurisdiction": {
          "type": "string",
          "pattern": "^([A-Z]{2}(-[A-Z0-9]{1,3})?|EU|EEA|UK|GLOBAL)$",
          "description": "Primary jurisdiction governing the vendor relationship, as an ISO 3166-1 alpha-2 country code, an ISO 3166-2 region code, or one of EU, EEA, UK, GLOBAL. Determines which regulatory frameworks the triage applies."
        },
        "primary_contact": {
          "type": "object",
          "additionalProperties": false,
          "required": ["name", "email"],
          "description": "Person accountable for the submission on the deploying organization's side, used for follow-up on validation failures and re-review.",
          "properties": {
            "name": {
              "type": "string",
              "minLength": 1,
              "maxLength": 256,
              "description": "Full name of the accountable contact."
            },
            "email": {
              "type": "string",
              "format": "email",
              "description": "Working email address for the accountable contact."
            }
          }
        },
        "vendor_classification": {
          "type": "string",
          "enum": ["SaaS", "infrastructure", "model_provider", "embedded_AI", "hybrid"],
          "description": "Category of the vendor relationship. With ai_usage_level, anchors the initial risk tier."
        },
        "ai_usage_level": {
          "type": "string",
          "enum": ["none", "productivity_only", "operational_decisions", "customer_facing", "regulated_decisions"],
          "description": "Highest level at which the vendor's AI participates in decisions, ordered from no AI use to AI in decisions under direct regulatory scrutiny. The primary driver of the risk tier defined in docs/phase-0/01-risk-classification.md."
        },
        "documentation_artifacts": {
          "type": "array",
          "minItems": 1,
          "description": "References to the documentation backing the submission. At least one artifact is required so every classification is tied to evidence.",
          "items": {
            "type": "object",
            "additionalProperties": false,
            "required": ["artifact_type", "reference"],
            "properties": {
              "artifact_type": {
                "type": "string",
                "enum": ["soc2_report", "security_questionnaire", "model_card", "data_processing_agreement", "privacy_policy", "architecture_document", "other"],
                "description": "Kind of documentation the reference points to."
              },
              "reference": {
                "type": "string",
                "minLength": 1,
                "maxLength": 1024,
                "description": "Locator for the artifact in the deploying organization's document store, such as a URI or content-addressed identifier. The contract records the reference; it does not parse the artifact."
              },
              "content_hash": {
                "type": "string",
                "pattern": "^sha256:[a-f0-9]{64}$",
                "description": "Optional SHA-256 hash of the artifact, as sha256:<hex>, so the record can prove which exact document was submitted."
              }
            }
          }
        },
        "submission_timestamp": {
          "type": "string",
          "format": "date-time",
          "description": "ISO 8601 datetime at which the submission entered intake. Establishes when the agent saw this state of the vendor's documentation."
        },
        "schema_version": {
          "type": "string",
          "pattern": "^\\d+\\.\\d+\\.\\d+$",
          "description": "Semver version of this input contract the submission targets. Travels with the resulting triage record so the contract that produced a decision is always recoverable."
        },
        "ai_features_disclosed": {
          "type": "array",
          "description": "Specific AI features the vendor discloses. Optional; presence raises classification confidence, absence lowers it without blocking a decision.",
          "items": {
            "type": "object",
            "additionalProperties": false,
            "required": ["feature_name", "description"],
            "properties": {
              "feature_name": {
                "type": "string",
                "minLength": 1,
                "maxLength": 256,
                "description": "Short name of the disclosed feature."
              },
              "description": {
                "type": "string",
                "minLength": 1,
                "maxLength": 2000,
                "description": "Bounded prose description of what the feature does and where it sits in the vendor's product."
              },
              "decision_role": {
                "type": "string",
                "enum": ["none", "supporting", "operational", "customer_facing", "regulated"],
                "description": "Role the feature plays in decisions, mirroring ai_usage_level at the level of an individual feature."
              },
              "autonomy": {
                "type": "string",
                "enum": ["human_initiated", "human_confirmed", "autonomous"],
                "description": "Degree of autonomy the feature exercises: actions a human triggers, actions a human confirms, or actions the feature takes on its own."
              }
            }
          }
        },
        "model_providers": {
          "type": "array",
          "description": "Named third-party model providers the vendor relies on, if disclosed.",
          "items": {
            "type": "string",
            "minLength": 1,
            "maxLength": 256
          }
        },
        "training_data_sources": {
          "type": "array",
          "description": "Categories or sources of training data the vendor discloses. Recorded as the vendor's representation, not a verified fact.",
          "items": {
            "type": "string",
            "minLength": 1,
            "maxLength": 512
          }
        },
        "pii_processing_claims": {
          "type": "object",
          "additionalProperties": false,
          "description": "Vendor's claims about the personal information its AI processes. Informs the privacy considerations in the privacy and data handling spec.",
          "properties": {
            "processes_pii": {
              "type": "boolean",
              "description": "Whether the vendor states its AI processes personal information at all."
            },
            "categories": {
              "type": "array",
              "description": "Categories of personal information processed, such as contact data, financial identifiers, or special-category data.",
              "items": {
                "type": "string",
                "minLength": 1,
                "maxLength": 256
              }
            },
            "handling_notes": {
              "type": "string",
              "maxLength": 2000,
              "description": "Bounded prose notes on how the vendor states it handles the personal information it processes."
            }
          }
        },
        "data_residency": {
          "type": "object",
          "additionalProperties": false,
          "description": "Where the vendor stores and processes data, and under what conditions.",
          "properties": {
            "regions": {
              "type": "array",
              "description": "Regions in which data is stored or processed, as country or region codes.",
              "items": {
                "type": "string",
                "pattern": "^([A-Z]{2}(-[A-Z0-9]{1,3})?|EU|EEA|UK|GLOBAL)$"
              }
            },
            "conditions": {
              "type": "string",
              "maxLength": 2000,
              "description": "Bounded prose describing residency conditions, such as contractual data-localization commitments or cross-border transfer mechanisms."
            }
          }
        },
        "compliance_attestations": {
          "type": "array",
          "description": "Attestations the vendor holds against named frameworks.",
          "items": {
            "type": "object",
            "additionalProperties": false,
            "required": ["framework", "attestation_type"],
            "properties": {
              "framework": {
                "type": "string",
                "minLength": 1,
                "maxLength": 256,
                "description": "Framework the attestation is against, such as SOC 2, ISO 27001, or ISO 42001."
              },
              "attestation_type": {
                "type": "string",
                "minLength": 1,
                "maxLength": 256,
                "description": "Type of attestation, such as a Type II report, a certification, or a self-attestation."
              },
              "date": {
                "type": "string",
                "format": "date",
                "description": "Date the attestation was issued, as an ISO 8601 date."
              },
              "validity_period": {
                "type": "string",
                "maxLength": 128,
                "description": "Bounded statement of how long the attestation is valid, such as an ISO 8601 duration or an explicit expiry date."
              }
            }
          }
        },
        "ai_act_self_classification": {
          "type": "string",
          "enum": ["prohibited", "high_risk", "limited_risk", "minimal_risk", "not_applicable", "not_assessed"],
          "description": "Vendor's own EU AI Act risk classification of its system. Recorded as the vendor's assessment; the deploying organization performs its own classification per docs/phase-0/01-risk-classification.md."
        },
        "prior_triage_record_id": {
          "type": "string",
          "minLength": 1,
          "maxLength": 128,
          "description": "Identifier of a previous triage record for this vendor, present when the submission is a re-review. Links the new decision to the one it supersedes."
        },
        "vendor_disclosed_subprocessors": {
          "type": "array",
          "description": "Subprocessors the vendor discloses, including any that provide AI capabilities.",
          "items": {
            "type": "object",
            "additionalProperties": false,
            "required": ["name"],
            "properties": {
              "name": {
                "type": "string",
                "minLength": 1,
                "maxLength": 256,
                "description": "Name of the subprocessor."
              },
              "role": {
                "type": "string",
                "maxLength": 512,
                "description": "Bounded description of what the subprocessor does in the vendor's service."
              },
              "location": {
                "type": "string",
                "pattern": "^([A-Z]{2}(-[A-Z0-9]{1,3})?|EU|EEA|UK|GLOBAL)$",
                "description": "Primary location of the subprocessor, as a country or region code."
              },
              "processes_customer_data": {
                "type": "boolean",
                "description": "Whether the subprocessor processes the deploying organization's customer data."
              }
            }
          }
        }
      }
    }
  }
}
